<!--
I pledge my honor that all parts of this project were done by me alone and
without collaboration with anybody else.

CSE532 - Project 3
File name: CSE532.xml
Author: Yishuo Wang (108533945)
Brief description: CSE532.xml have all the data in
-->
<CSE532 xmlns="http://localhost:8080/exist/CSE532" xmlns:xsi="http://www.w3.org/2001/XMLSchema-instance" xsi:schemaLocation="http://localhost:8080/exist/CSE532 CSE532.xsd">

    <Contestant>
        <CId>c1</CId>
        <Name>Joe</Name>
        <Audition>
            <Score>7</Score>
            <Show>
                <SId>s1</SId>
                <Date>2014-02-02</Date>
            </Show>
            <Artwork>
                <AId>a1</AId>
                <Name>Barcarolle</Name>
            </Artwork>
            <Judge>
                <JId>j1</JId>
                <Name>Judy</Name>
            </Judge>
        </Audition>

        <Audition>
            <Score>8</Score>
            <Show>
                <SId>s1</SId>
                <Date>2014-02-02</Date>
            </Show>
            <Artwork>
                <AId>a1</AId>
                <Name>Barcarolle</Name>
            </Artwork>
            <Judge>
                <JId>j2</JId>
                <Name>Lucy</Name>
            </Judge>
        </Audition>

        <Audition>
            <Score>6</Score>
            <Show>
                <SId>s1</SId>
                <Date>2014-02-02</Date>
            </Show>
            <Artwork>
                <AId>a1</AId>
                <Name>Barcarolle</Name>
            </Artwork>
            <Judge>
                <JId>j3</JId>
                <Name>Irving</Name>
            </Judge>
        </Audition>

        <Audition>
            <Score>7</Score>
            <Show>
                <SId>s4</SId>
                <Date>2014-08-02</Date>
            </Show>
            <Artwork>
                <AId>a3</AId>
                <Name>Bumblebee</Name>
            </Artwork>
            <Judge>
                <JId>j2</JId>
                <Name>Lucy</Name>
            </Judge>
        </Audition>
        
        <Audition>
            <Score>6</Score>
            <Show>
                <SId>s4</SId>
                <Date>2014-08-02</Date>
            </Show>
            <Artwork>
                <AId>a3</AId>
                <Name>Bumblebee</Name>
            </Artwork>
            <Judge>
                <JId>j5</JId>
                <Name>Oscar</Name>
            </Judge>
        </Audition>
    </Contestant>

    <Contestant>
        <CId>c2</CId>
        <Name>Bob</Name>
        <Audition>
            <Score>8</Score>
            <Show>
                <SId>s2</SId>
                <Date>2014-04-02</Date>
            </Show>
            <Artwork>
                <AId>a5</AId>
                <Name>Swan Lake</Name>
            </Artwork>
            <Judge>
                <JId>j1</JId>
                <Name>Judy</Name>
            </Judge>
        </Audition>

        <Audition>
            <Score>6</Score>
            <Show>
                <SId>s2</SId>
                <Date>2014-04-02</Date>
            </Show>
            <Artwork>
                <AId>a5</AId>
                <Name>Swan Lake</Name>
            </Artwork>
            <Judge>
                <JId>j4</JId>
                <Name>Phil</Name>
            </Judge>
        </Audition>
        
        <Audition>
            <Score>8</Score>
            <Show>
                <SId>s3</SId>
                <Date>2014-06-05</Date>
            </Show>
            <Artwork>
                <AId>a3</AId>
                <Name>Bumblebee</Name>
            </Artwork>
            <Judge>
                <JId>j3</JId>
                <Name>Irving</Name>
            </Judge>
        </Audition>
        <Audition>
            <Score>7</Score>
            <Show>
                <SId>s3</SId>
                <Date>2014-06-05</Date>
            </Show>
            <Artwork>
                <AId>a3</AId>
                <Name>Bumblebee</Name>
            </Artwork>
            <Judge>
                <JId>j4</JId>
                <Name>Phil</Name>
            </Judge>
        </Audition>
        <Audition>
            <Score>9</Score>
            <Show>
                <SId>s3</SId>
                <Date>2014-06-05</Date>
            </Show>
            <Artwork>
                <AId>a3</AId>
                <Name>Bumblebee</Name>
            </Artwork>
            <Judge>
                <JId>j5</JId>
                <Name>Oscar</Name>
            </Judge>
        </Audition>

        <Audition>
            <Score>6</Score>
            <Show>
                <SId>s4</SId>
                <Date>2014-08-02</Date>
            </Show>
            <Artwork>
                <AId>a1</AId>
                <Name>Barcarolle</Name>
            </Artwork>
            <Judge>
                <JId>j2</JId>
                <Name>Lucy</Name>
            </Judge>
        </Audition>
        <Audition>
            <Score>8</Score>
            <Show>
                <SId>s4</SId>
                <Date>2014-08-02</Date>
            </Show>
            <Artwork>
                <AId>a1</AId>
                <Name>Barcarolle</Name>
            </Artwork>
            <Judge>
                <JId>j5</JId>
                <Name>Oscar</Name>
            </Judge>
        </Audition>

        <Audition>
            <Score>3</Score>
            <Show>
                <SId>s5</SId>
                <Date>2014-06-05</Date>
            </Show>
            <Artwork>
                <AId>a5</AId>
                <Name>Swan Lake</Name>
            </Artwork>
            <Judge>
                <JId>j2</JId>
                <Name>Lucy</Name>
            </Judge>
        </Audition>
        <Audition>
            <Score>5</Score>
            <Show>
                <SId>s5</SId>
                <Date>2014-06-05</Date>
            </Show>
            <Artwork>
                <AId>a5</AId>
                <Name>Swan Lake</Name>
            </Artwork>
            <Judge>
                <JId>j3</JId>
                <Name>Irving</Name>
            </Judge>
        </Audition>
        <Audition>
            <Score>6</Score>
            <Show>
                <SId>s5</SId>
                <Date>2014-06-05</Date>
            </Show>
            <Artwork>
                <AId>a5</AId>
                <Name>Swan Lake</Name>
            </Artwork>
            <Judge>
                <JId>j4</JId>
                <Name>Phil</Name>
            </Judge>
        </Audition>

        <Audition>
            <Score>4</Score>
            <Show>
                <SId>s5</SId>
                <Date>2014-06-05</Date>
            </Show>
            <Artwork>
                <AId>a2</AId>
                <Name>Giselle</Name>
            </Artwork>
            <Judge>
                <JId>j2</JId>
                <Name>Lucy</Name>
            </Judge>
        </Audition>
        <Audition>
            <Score>6</Score>
            <Show>
                <SId>s5</SId>
                <Date>2014-06-05</Date>
            </Show>
            <Artwork>
                <AId>a2</AId>
                <Name>Giselle</Name>
            </Artwork>
            <Judge>
                <JId>j3</JId>
                <Name>Irving</Name>
            </Judge>
        </Audition>
        <Audition>
            <Score>8</Score>
            <Show>
                <SId>s5</SId>
                <Date>2014-06-05</Date>
            </Show>
            <Artwork>
                <AId>a2</AId>
                <Name>Giselle</Name>
            </Artwork>
            <Judge>
                <JId>j4</JId>
                <Name>Phil</Name>
            </Judge>
        </Audition>
    </Contestant>

    <Contestant>
        <CId>c3</CId>
        <Name>Mary</Name>
        <Audition>
            <Score>5</Score>
            <Show>
                <SId>s1</SId>
                <Date>2014-02-02</Date>
            </Show>
            <Artwork>
                <AId>a1</AId>
                <Name>Barcarolle</Name>
            </Artwork>
            <Judge>
                <JId>j1</JId>
                <Name>Judy</Name>
            </Judge>
        </Audition>
        <Audition>
            <Score>6</Score>
            <Show>
                <SId>s1</SId>
                <Date>2014-02-02</Date>
            </Show>
            <Artwork>
                <AId>a1</AId>
                <Name>Barcarolle</Name>
            </Artwork>
            <Judge>
                <JId>j2</JId>
                <Name>Lucy</Name>
            </Judge>
        </Audition>
        <Audition>
            <Score>6</Score>
            <Show>
                <SId>s1</SId>
                <Date>2014-02-02</Date>
            </Show>
            <Artwork>
                <AId>a1</AId>
                <Name>Barcarolle</Name>
            </Artwork>
            <Judge>
                <JId>j3</JId>
                <Name>Irving</Name>
            </Judge>
        </Audition>
        <Audition>
            <Score>9</Score>
            <Show>
                <SId>s1</SId>
                <Date>2014-02-02</Date>
            </Show>
            <Artwork>
                <AId>a2</AId>
                <Name>Giselle</Name>
            </Artwork>
            <Judge>
                <JId>j1</JId>
                <Name>Judy</Name>
            </Judge>
        </Audition>
        <Audition>
            <Score>6</Score>
            <Show>
                <SId>s1</SId>
                <Date>2014-02-02</Date>
            </Show>
            <Artwork>
                <AId>a2</AId>
                <Name>Giselle</Name>
            </Artwork>
            <Judge>
                <JId>j2</JId>
                <Name>Lucy</Name>
            </Judge>
        </Audition>
        <Audition>
            <Score>8</Score>
            <Show>
                <SId>s1</SId>
                <Date>2014-02-02</Date>
            </Show>
            <Artwork>